{
  "$schema": "https://json-schema.org/draft/2020-12/schema",
  "$id": "https://local.invalid/llm-interop/result.schema.json",
  "title": "LLM interop result",
  "type": "object",
  "additionalProperties": false,
  "required": [
    "schema_version", "task_id", "status", "summary", "checks", "changes",
    "assumptions", "risks", "questions", "next_step"
  ],
  "properties": {
    "schema_version": {"type": "string", "enum": ["1.0"]},
    "task_id": {"type": "string", "minLength": 1},
    "status": {"enum": ["completed", "blocked", "needs_input"]},
    "summary": {"type": "string", "minLength": 1},
    "checks": {
      "type": "array",
      "minItems": 1,
      "items": {
        "type": "object",
        "additionalProperties": false,
        "required": ["name", "status", "evidence"],
        "properties": {
          "name": {"type": "string", "minLength": 1},
          "status": {"enum": ["pass", "fail", "not_run"]},
          "evidence": {"type": "string", "minLength": 1}
        }
      }
    },
    "changes": {"type": "array", "items": {"type": "string", "pattern": "^(?!/|~|[A-Za-z]:)(?!.*(?:^|/)\\.\\.(?:/|$))(?!.*\\\\).+$"}},
    "assumptions": {"type": "array", "items": {"type": "string"}},
    "risks": {"type": "array", "items": {"type": "string"}},
    "questions": {"type": "array", "items": {"type": "string"}},
    "next_step": {"type": "string"}
  }
}
