{
  "schema_version": "1.0",
  "task_id": "interop-smoke-codex",
  "status": "completed",
  "summary": "Дизайн Эпика 4 содержит все четыре требуемые секции: Goal, Context, Constraints и проверяемый Done when.",
  "checks": [
    {
      "name": "Goal",
      "status": "pass",
      "evidence": "В файле docs/superpowers/specs/2026-07-15-epic4-llm-interop-design.md есть секция «## Goal»: задан общий способ поставить задачу, вызвать партнёра, получить проверяемый результат и передать сессию без vendor-specific транскриптов."
    },
    {
      "name": "Context",
      "status": "pass",
      "evidence": "В файле есть секция «## Context» с четырьмя исходными условиями: расположение канона, vendor-neutral правила, headless-вызовы со структурированным выводом и несовместимость форматов внутренних сессий."
    },
    {
      "name": "Constraints",
      "status": "pass",
      "evidence": "В файле есть секция «## Constraints» с шестью ограничениями, включая явное включение записи, UTF-8, относительные пути, защиту секретов и отказ от постоянного MCP при достаточности direct-exec."
    },
    {
      "name": "Done when",
      "status": "pass",
      "evidence": "В файле есть секция «## Done when» с шестью проверяемыми критериями: валидность skill, тесты JSON-схем, безопасный dry-run, реальный read-only smoke, прохождение codex_sync.py и независимый аудит."
    }
  ],
  "changes": [],
  "assumptions": [
    "Наличие секции оценено по явному Markdown-заголовку и содержанию непосредственно под ним.",
    "Проверяемость Done when оценена по наличию наблюдаемых результатов или явно фиксируемого блокера."
  ],
  "risks": [],
  "questions": [],
  "next_step": "Дополнительные действия для этой smoke-проверки не требуются."
}
